{
  "$schema": "../../schema/scheme.schema.json",

  "id": "tn-disability-pension",
  "name": "Differently Abled Pension",
  "full_name": "Destitute Differently Abled Pension Scheme (Tamil Nadu)",
  "level": "state",
  "state": "TN",
  "summary": "A monthly pension for destitute people with a disability of 40% or more.",

  "benefit_value": 1500,
  "benefit_period": "month",
  "benefit_type": "grant",
  "benefit_note": "₹1,500 a month, credited directly to a bank account.",
  "effort_level": "HARD",
  "official_fee": 0,

  "is_rolling": true,
  "application_start": null,
  "application_end": null,
  "scheme_status": "active",

  "application_url": "https://cra.tn.gov.in/",
  "source_url": "https://cra.tn.gov.in/about_schemes_t.php",
  "official_video_url": null,

  "documents": [
    "disability_certificate",
    "aadhaar_card",
    "income_certificate",
    "bank_passbook",
    "residence_proof"
  ],

  "how_to_apply": [
    "Get a disability certificate from a government medical board if you do not have one.",
    "Apply at your Village Administrative Officer, Gram Panchayat or Urban Local Body office, or the District Differently Abled Welfare Office.",
    "Once approved, the pension is credited to your bank account each month."
  ],

  "common_pitfalls": [],

  "rules": {
    "all": [
      {
        "id": "disability-40-percent-or-more",
        "field": "disability_percent",
        "op": "gte",
        "value": 40,
        "label": "Disability assessed at 40% or more",
        "fixable": true,
        "fix_hint": "The percentage comes from a disability certificate issued by a government medical board. If you have never been assessed, the District Differently Abled Welfare Office can arrange it.",
        "pass_template": "Your disability is assessed at {user_value}%, at or above the {threshold}% this pension needs.",
        "fail_template": "Your disability is assessed at {user_value}%, below the {threshold}% this pension needs.",
        "source_quote": "disability 40% or above"
      },
      {
        "id": "aged-18-or-over",
        "field": "age",
        "op": "gte",
        "value": 18,
        "label": "Aged 18 or over",
        "fixable": false,
        "fix_hint": null,
        "pass_template": "You are {user_value}, over the minimum age of {threshold}.",
        "fail_template": "You are {user_value}. This pension starts at {threshold}.",
        "source_quote": "age 18+"
      },
      {
        "id": "is-destitute",
        "field": "is_destitute",
        "op": "equals",
        "value": true,
        "label": "Destitute — no regular means of support",
        "fixable": false,
        "fix_hint": null,
        "pass_template": "This pension is for people with no regular means of support.",
        "fail_template": "This pension is for people who are destitute, with no regular means of support.",
        "source_quote": "Destitute"
      }
    ]
  },

  "curation_status": "draft",
  "last_verified": null,
  "verified_by": null,
  "checked_by": null,
  "curation_notes": [
    "DRAFT — not yet read by a human against the official page. Do not ship.",
    "TRANSLATION WARNING. Amounts and the 40% threshold come from the TAMIL version of the Commissionerate of Revenue Administration page (cra.tn.gov.in/about_schemes_t.php), read through automatic translation on 2026-08-09. A Tamil reader must confirm.",
    "THE THRESHOLD CONFLICT IS RESOLVED: the sources were describing different schemes, not contradicting each other. Tamil Nadu runs at least three kinds of disability payment. (1) This pension, from the Revenue Department, at 40%. (2) The centrally sponsored IGNDPS, quoted at 60% by a district portal and 80% by the CRA page — that one is still unresolved and IGNDPS is not yet in the corpus. (3) Four separate maintenance allowances from the Differently Abled Welfare Commissionerate, each with its own condition, now curated as tn-maintenance-allowance-*.json. 40% is correct for this file.",
    "A person may qualify for this pension AND a maintenance allowance. Whether they can draw both is not stated anywhere we have found, and we do not model benefit stacking — the card should not imply the amounts add up.",
    "TO CONFIRM: an income condition. The translated page mentions an annual income limit around ₹3 lakh attached to self-employed applicants, but the sentence did not survive translation cleanly. No income rule has been written rather than guess at one. Find it.",
    "TO CONFIRM: an employment condition. The translation suggests the applicant must be unemployed, which is a significant rule if true. Not written.",
    "This is the first scheme in the corpus with a FIXABLE non-money numeric gap — someone never formally assessed can get a disability certificate. That makes it a good demo for step 8.",
    "SENSITIVE. disability_percent and has_disability must be asked inside this scheme's flow, not the general wizard.",
    "TO CONFIRM: the documents list. Not given on the official page."
  ]
}
