{
  "$schema": "../../schema/scheme.schema.json",

  "id": "tn-destitute-widow-pension",
  "name": "Destitute Widow Pension",
  "full_name": "Destitute Widow Pension Scheme (Tamil Nadu)",
  "level": "state",
  "state": "TN",
  "summary": "A monthly pension for destitute widows with little or no property.",

  "benefit_value": 1200,
  "benefit_period": "month",
  "benefit_type": "grant",
  "benefit_note": "₹1,200 a month, credited directly to a bank account.",
  "effort_level": "HARD",
  "official_fee": 0,

  "is_rolling": true,
  "application_start": null,
  "application_end": null,
  "scheme_status": "active",

  "application_url": "https://cra.tn.gov.in/",
  "source_url": "https://cra.tn.gov.in/about_schemes_t.php",
  "official_video_url": null,

  "documents": [
    "death_certificate",
    "aadhaar_card",
    "income_certificate",
    "bank_passbook",
    "residence_proof"
  ],

  "how_to_apply": [
    "Collect your husband's death certificate.",
    "Apply at your Village Administrative Officer, Gram Panchayat or Urban Local Body office.",
    "Once approved, the pension is credited to your bank account each month."
  ],

  "common_pitfalls": [],

  "rules": {
    "all": [
      {
        "id": "applicant-is-a-widow",
        "field": "marital_status",
        "op": "equals",
        "value": "widowed",
        "label": "The applicant is a widow",
        "fixable": false,
        "fix_hint": null,
        "pass_template": "This pension is for widows.",
        "fail_template": "This pension is for widows.",
        "source_quote": "Destitute widow"
      },
      {
        "id": "aged-18-or-over",
        "field": "age",
        "op": "gte",
        "value": 18,
        "label": "Aged 18 or over",
        "fixable": false,
        "fix_hint": null,
        "pass_template": "You are {user_value}, over the minimum age of {threshold}.",
        "fail_template": "You are {user_value}. This pension starts at {threshold}.",
        "source_quote": "age 18+"
      },
      {
        "id": "is-destitute",
        "field": "is_destitute",
        "op": "equals",
        "value": true,
        "label": "Destitute — no regular means of support",
        "fixable": false,
        "fix_hint": null,
        "pass_template": "This pension is for widows with no regular means of support.",
        "fail_template": "This pension is for widows who are destitute, with no regular means of support.",
        "source_quote": "Destitute widow"
      },
      {
        "id": "property-under-one-lakh",
        "field": "immovable_property_value",
        "op": "lte",
        "value": 100000,
        "label": "Immovable property worth ₹1,00,000 or less",
        "fixable": false,
        "fix_hint": null,
        "pass_template": "Your property is worth ₹{user_value}, within the ₹{threshold} limit.",
        "fail_template": "Your property is worth ₹{user_value}, above the ₹{threshold} limit for this pension.",
        "source_quote": "immovable property ≤₹1,00,000"
      }
    ]
  },

  "curation_status": "draft",
  "last_verified": null,
  "verified_by": null,
  "checked_by": null,
  "curation_notes": [
    "DRAFT — not yet read by a human against the official page. Do not ship.",
    "TRANSLATION WARNING. Amounts and the property limit come from the TAMIL version of the Commissionerate of Revenue Administration page (cra.tn.gov.in/about_schemes_t.php), read through automatic translation on 2026-08-09. A Tamil reader must confirm, particularly the ₹1,00,000 property figure.",
    "DISTINCT FROM THE CENTRAL WIDOW PENSION. The Indira Gandhi National Widow Pension Scheme starts at age 40 and requires below poverty line status; this state scheme starts at 18 and uses a property test instead. Both exist in Tamil Nadu. IGNWPS is not yet in the corpus and should be added separately rather than merged into this file.",
    "ALSO DISTINCT FROM the Dr. Dharmambal widow REMARRIAGE assistance already in the corpus. That is a one-off payment on remarrying; this is an ongoing pension. A widow could qualify for both at different times.",
    "TO CONFIRM: how immovable property is valued and who assesses it. The profile asks the user for a number, which is unlikely to match the department's method.",
    "TO CONFIRM: the documents list. Not given on the official page."
  ]
}
